author,title,topic
Jibrish,/r/Conservative Official Political Discord,OTHER
Lionhearted09,Holocaust Museum In Florida Sparks Outrage After Adding George Floyd Exhibit,OTHER
Winterhold2000,Lin Wood tells Republican supporters NOT to back GOP candidates in the Georgia runoff election because they've 'failed' to help the President's fight to overturn the election,OTHER
optionhome,"Do Trump-Supporters Live in an Alternate Universe? Actually a huge number of Americans have a false impression of reality because they are being told lies by their media. The people who constantly hear these lies do live in an ""alternate reality.""",
guanaco55,"After Trans Activists Try To Ban The Book ‘Irreversible Damage,’ It Becomes A Bestseller -- Trans activists keep bullying businesses into removing content through fear tactics rather than by countering the message with their own better one.",OTHER
optionhome,Nearly 40 Shot Friday into Sunday Morning in Lightfoot's Chicago,OTHER
Pessimist2020,Gavin Newsom Alerted To Illegal Activity By The Sound Of Children’s Laughter,OTHER
domisking92,"In Canada, you have to show ID and proof of address to vote in Federal elections",OTHER
cavboy2flyboy,Trump campaign says Sidney Powell not a member of legal team,
Qplus17,"In Apparent Glitch, Voting Machines Hunt Down And Murder Trump Supporters",
Drunken_Priest,‘It Will Be Epic’: Sidney Powell Releases Another Statement After Lawyers Say She’s Not On Team,OTHER
LunchroomRumble,Beijing-Controlled News Outlet Paid US Newspapers Millions To Publish Propaganda This Year,OTHER
skonats,Calls for Britain to give asylum to Pakistani Christian girl forced to marry Muslim man who abducted and gang-raped her,OTHER
LimeSugar,‘You’re Such A D**k’: New Jersey Gov Confronted Eating Maskless Outside With His Family,OTHER
Nucka574,"Sidney Powell Confirms Non-Affiliation With Trump Legal Team, Vows to Continue Fraud Fight",
guanaco55,"Sidney Powell Responds to Trump Campaign's Statement Saying She's Not Part of Legal Team -- Powell said her fight will go on anyway and closed her statement with the hashtag, ""#KrakenOnSteroids""",
Beliavsky,"“Burn It Down” -- Activists in Seattle want to abolish police, prisons, and courts.",OTHER
Juliemylove,Protesters take to the streets in California to bash Newsom's curfew orders,OTHER
Winterhold2000,Police Union Tells Embattled New York Subway Riders 'You're on Your Own' amid the recent rash of shoving incidents by unhinged assailants,OTHER
ThePoliticalHat,"Harvard creating new ‘antiracism’ librarian job. It pays up to $240,300 per year.",OTHER
guanaco55,"Why The Left Can Be So Ridiculously Self-Righteous Without Realizing It -- What we saw in the lead up to the elections, and what we’ll witness for years to come, is utter contempt for Trump voters and conservatives in general.",
tenshon,Two-thirds of GOP voters support Trump running for president in 2024: survey,
unspecialnoob,5 More Ways Joe Biden Magically Outperformed Election Norms,
Snipuh21,Democrat House Losses Stemmed From Trump Increasing Voter Turnout: Rep. Richmond,
Winterhold2000,"Juan Williams: Obama's dire warnings about right-wing media. The power of right-wing media to distort reality “is the single biggest threat to our democracy,” Obama added. He found that GOP politicians concluded it was “politically advantageous to demonize me and the Democratic Party.”",OTHER
guanaco55,Lou Dobbs Warns the GOP: Republican Party ‘Will Be Gone and Done’ If They Don’t Stand With President Trump,
jade_crayon,China now blaming Italy for starting Wuhan coronavirus pandemic,OTHER
Shlomo_Maistre,Late Justice Scalia's son blasts Harris for insinuating Catholic charity a hate group,OTHER
huckingfoes,Walmart Thanks Government For Completely Obliterating Their Small Business Competition,OTHER
Shlomo_Maistre,"‘You Can’t Enforce’ Thanksgiving Lockdowns, New Mexico Governor Says",OTHER
guanaco55,A Neighbor You Like Probably Voted For Trump,
iResistBS,Judge Denies Injunction for “Black Only Relief Fund”,OTHER
200319594,"HISTORIC: Netanyahu Meets Saudi Prince in Saudi Arabia, Reports Say",OTHER
Hps96,Viral video shows New York business owners take defiant stand when health inspector barges inside: 'Go get a warrant',OTHER
optionhome,WHO Director Dr. Tedros Moves the COVID-19 Goalposts Right Off the Playing Field. He wants you to know that vaccines won’t really change anything in response to COVID-19. His statement defies the management of any virus and there is no science to support it.,OTHER
nobody65,"Trump obsession: Democrats tweet about him 12,569 times to 486 about Biden",
optionhome,Union Bosses Sink Bernie Sanders as Labor Secretary,OTHER
canfbar,"Israel’s Netanyahu, Saudi Crown Prince Hold First Known Meeting",OTHER
HighRoller390,"""Georgia Is the First State I’m Going to Blow Up and Mr. Kemp and the Secretary of State Need to Go With It!” — Sidney Powell",OTHER
guanaco55,"Bombshell: Biden takes min 98% of a 23,487 vote batch at 12:18AM in GA",
guanaco55,"America Needs A Special Counsel To Investigate Election Integrity, Stat -- With credible allegations of fraud compounding by the day, the American people deserve a special counsel investigation to set the record straight.",OTHER
triggernaut,"Trump Pulls Out Of Military Transparency Treaty With Russia, Europe",
livinginbizzaroworld,Putin Says He’s Not Ready to Recognize Biden as U.S. President,
guanaco55,'Call of Duty: Black Ops Cold War' Affirms a Pro-American Worldview -- A rich gaming environment replete with Reagan administration cameos is just what the doctor ordered.,OTHER
reggie23e,Black Lives Matter Wisconsin leader - a convicted felon - arrested on suspicion of sexual assault,OTHER
freq-ee,Trump’s legal team’s statement on Sydney Powell was made to focus on the upcoming Supreme Court case. There are two separate legal pathways. One on equal protection and PA voting rules (most important right now). The second is Dominion software which will take longer.,
adp_17,GOP Likely to Gain Third US House Seat in California,OTHER
Winterhold2000,George Takei: ‘I Want to Live in a Country Where Kaepernick is Seen as a Hero and Kyle Rittenhouse Is Seen as a Terrorist’,OTHER
guanaco55,HBO talkshow host Bill Maher slams Democrats for hypocrisy on COVID-19 protocol -- “They keep getting caught doing what we’re not allowed to do.”,OTHER
HighRoller390,"If the 2020 Election Was Held in a Foreign Country, the State Department and Western Media Would Declare it ""Fraudulent"" -",OTHER
JonnyBlizzard,Portman: No proof of mass fraud that would change election result,OTHER
200319594,Viral Video: NJ Gov. Phil Murphy Confronted At Restaurant For Not Wearing Mask,OTHER
Dale_Gunther,"Annoyed ABC Scolds Americans 'Not Listening,' Visiting Family on Thanksgiving",OTHER
guanaco55,Left-Wing Activist And Actress Alyssa Milano Warned Against Electronic Voting Machines in 2018: ‘We Need Paper Ballots’,OTHER
XIIXOO,"These 21 GOP Senators Show ‘Extreme Contempt’ For Trump In Private, According To Carl Bernstein",
ChunkyArsenio,"WSJ Editorial Board: Stockton, CA elects Republican Mayor vowing safer streets",OTHER
Winterhold2000,New York Democratic Leaders Caught Maskless At Private Party Despite COVID Restrictions,OTHER
Shlomo_Maistre,"Civil Disobedience: WATCH Angry business owners RESIST Cuomo's enforcement visit by Health Dept, Sheriff ⋆ The Savage Nation",OTHER
guanaco55,"How Trump Responded When Liz Cheney Called on Him to Concede: ""Sorry Liz, can’t accept the results of an election with hundreds of thousands of fraudulent votes cast, enough to easily flip the Election. You’re just unhappy that I’m bringing the troops back home where they belong!""",
tenshon,Pope Francis in new book criticizes anti-lockdown protesters,OTHER
guanaco55,Trump: More Votes Than Voters in Key Swing States,
Knowledge-Future,Michael Flynn: Sidney Powell temporarily suspended from Twitter,OTHER
XIIXOO,Dominion Voting Systems says it is 'physically impossible' for their machines to switch votes for candidates,OTHER
HighRoller390,Watergate journalist Carl Bernstein outs 21 Republican senators who 'privately' expressed 'extreme contempt' for Trump.,
theradiostarz,Trump Campaign Formally Requests a Recount in Georgia,
geocentrist,"UK Physician - ""Frankly, if it had not been for mainstream media and the government, I would not have even noticed there were a pandemic. I experienced no excessive dying, and no excessive becoming seriously ill.""",OTHER
optionhome,In Oregon Crack cocaine was legalized in a November 3rd referendum along with all other illicit drugs while plastic straws were prohibited. The Oregon Health Authority however wants people to stay safe and remember to pull your mask back into place between puffs on your crack pipe.,OTHER
Shlomo_Maistre,"Trump campaign demands recount, signature matching in Georgia",
ThePoliticalHat,Media Unveils Bold New Plan to Win Latino Support by Calling Them Racist,OTHER
optionhome,Newsom pressured to pick ‘woman of color’ to fill Senate seat. Former San Francisco Mayor Willie Brown is pushing Maxine Waters among others.,OTHER
Winterhold2000,"AOC: Does anyone believe Rittenhouse would be released if he were Muslim &amp; did the same thing in a diff context? For people who say “systemic racism doesn’t exist,” this is what it looks like: protection of white supremacy baked deep into our carceral systems.",OTHER
mikireal19,After Pelosi Claims She Wants To Provide Relief – Records Show 40 Times The House Democrats Blocked Relief Aid,OTHER
AnotherNewRddt,Federal judge dismisses Trump campaign’s Pennsylvania case,
guanaco55,"Court Rules Tennessee Can Outlaw Down Syndrome, Race, and Gender Abortions",OTHER
Shlomo_Maistre,Oregon governor backs idea of alerting authorities on neighbors who violate COVID-19 restrictions,OTHER
Winterhold2000,Open Letter Calls on Harvard to Create 'System of Accountability' for Inviting Trump Admin Alums to Campus,
Farmwife64,California School District Bans Use of Classic Books in Classroom Over Racism Complaints,OTHER
LawVol99,Latinos in South Texas Voted Against Illegal Immigration and CBP Demonization,OTHER
Dale_Gunther,5 More Ways Joe Biden Magically Outperformed Election Norms,
livinginbizzaroworld,"Statement from Sidney Powell to ""WE THE PEOPLE""",OTHER
walter_r_kovacs,This would literally kill me,OTHER
MuniPal,Sidney Powell Releases Statement,OTHER
tenshon,Majority say they want GOP in control of Senate: poll,OTHER
guanaco55,"Sidney Powell Is an American Legal Giant -- She is fighting for our Republic right now because – make no mistake – honest American elections, and the continuing viability of our democracy, is on the line.",OTHER
Shlomo_Maistre,The U.S. has withdrawn from the Treaty on Open Skies,OTHER
Practical-Share-44,: Election 2020 -- Are we witnessing the beginning of the end of wokeism?,OTHER
UrdukMemphis,Gov. Kemp calls for signature audit of Georgia vote,OTHER
Dale_Gunther,DC bill wants to allow kids to take vaccines without parents,OTHER
canfbar,"Do as I say, not as I do: California's top Democrats display their hypocrisy over COVID-19",OTHER
RandomSleepTimes,Eyes rolling so hard that I can see the back of my skull. I guess pollution is racist now too!,OTHER
Shlomo_Maistre,'Hundreds' Of NYC Coronavirus Victims' Bodies Still Being Stored In Freezer Trucks,OTHER
newaccttrial,Mass Protest at CNN: Your Fake News Gig Is Up,OTHER
Beliavsky,Banks Give Black-Owned Businesses Advantage on Supply-Chain Finance Terms. Programs spring from multibillion-dollar commitments banks made to expand lending and investment after Black Lives Matter protests this year,OTHER
Practical-Share-44,"House GOP wins suggests party growth, possible majority in 2022 | One America News Network",OTHER
Ar509,"CA-25: Garcia(R) declares victory, Smith declines to concede",OTHER
Shlomo_Maistre,George Soros-linked election software company lies about ties with Dominion | One America News Network,OTHER
HighRoller390,"Miami Herald warning on Smartmatic 3/29/2006: “Software engineers with links to the Leftist, anti-American regime of Hugo Chavez are in charge of programming electronic voting machines that will soon power U.S. elections”",OTHER
livinginbizzaroworld,LORD SUMPTION: Wrong for government to tell us what to do at Christmas,OTHER
guanaco55,Iowa's GOP Miller-Meeks Leads By 50 Votes In Nation's Closest House Race,OTHER
InkyScrolls,Joseph Stalin To Receive International Emmy For His Outstanding Hunger Relief Efforts,OTHER
Shlomo_Maistre,A dozen compelling allegations of voting irregularities in 2020 election,OTHER
Farmwife64,Lib Priest's Bashing of ACB's Latest Decision Accidentally Admits We Were Right All Along,OTHER
oz4ut,BREAKING: FDA Grants Emergency Use Authorization To Antibody Cocktail Used By Trump,
canfbar,China Proposes Global 'Track and Trace' System for Travel Reset,OTHER
Shlomo_Maistre,Report: LA County Restricting Indoor/Outdoor Dining Thanksgiving Eve,OTHER
alc59,Brooklyn political elite ignore COVID-19 rules at birthday party for Carlo Scissura,OTHER
HighRoller390,"Let's talk about the ""where is the evidence"" meme",OTHER
Coogrrr94,Mike Flynn Jr. adds twist to Trump team’s statement on Sidney Powell: ‘Give this the 24hr rule …’,
Winterhold2000,How to explain Latino support for Trump? ABC News reports misleading memes went viral in Latino communities,
Foubar_ghost,"High family income, not SAT scores, is your real ticket to Harvard, Yale, and Princeton",OTHER
nobody65,Reap What You Sow: Media Who Coddled Biden for Months Now Complain About Mistreatment,
adp_17,Kevin McCarthy: Voters Have Rejected Pelosi's 'Socialist' Agenda,OTHER
ChunkyArsenio,Julie Burchill: President Trump has loved and been great for Israel,
optionhome,"Illinois Governor Pritzker Snubs Lori Lightfoot's ""Do Not Travel"" Advisory. He May Leave Chicago For Thanksgiving",OTHER
guanaco55,"All Republicans should support President Trump's legal fights -- Any who believe that buddying up to the Biden team is a symbol of unity, and better for America, have already abandoned Trump, conservatism, and America.",
LawVol99,AOC slams Kyle Rittenhouse’s release on $2M bond as ‘law and disorder’,OTHER
ThePoliticalHat,The Latest Memorial to George Floyd Is in a Holocaust Museum,OTHER
guanaco55,The Fight Ahead: Our Media Is Trash. Their Words Are Worth Nothing. The fight ahead is real.,OTHER
0ldManFrank,"Omar Urges Biden To Reverse Trump's Agreements In The Middle East And Claims They Were ""Not Peace Deals""",
whitten93,Professor causes uproar asking Biden voters to unfriend him,
guanaco55,"Devout Catholic Joe Biden, our most pro-abortion president",
Beliavsky,"Religion, Liberty, and Religious Liberty. Macron is pushing France to confront the implications of Islamism for liberal democracy.",OTHER
TheYoungLung,Trump Lawyer Sidney Powell Promises 'Biblical' Lawsuit in Coming Days,
Briguy28,"Guatemalan protesters storm Congress, light building on fire as clashes with government forces escalate",OTHER
mobi1408,France: Macron and his Islamic Rivals | Jayzoq,OTHER
guanaco55,"An Urgent Appeal to WHO: Let Taiwan Speak -- If WHO is serious about the pandemic, it will listen to the nation that successfully confronted it — and stop kowtowing to Beijing.",OTHER
guanaco55,Alito Points to Warning Signs That Threaten a Free and Civil Society,OTHER
oz4ut,"BLM Founders Demand Joe Biden Support A 'Roadmap' To Abolition Of Police, Prisons",
Beliavsky,"Subway shoving, flamethrowers, shootings in NYC blamed on 'perfect storm' of police reform, pandemic. Shootings have almost doubled from last year following a long era of low crime rates",OTHER
geocentrist,"Dr. Michael Yeadon, former VP of Pfizer, explains in video why the pandemic is essentially over",OTHER
chitown12076,Pope Francis hosts NBA players to talk social justice.,OTHER
Ken-Crow,Will Republicans Learn From The 2020 Election?,OTHER
guanaco55,WaPo Columnist Has an Epic Meltdown Over Republicans Standing By Claims of Voter Fraud,OTHER
guanaco55,"To Restore Election Integrity, End Mail-In Vote Fraud",OTHER
Shlomo_Maistre,"Gen. Flynn: Sidney Powell 'Staying the Course,' Will Prove Alleged Election Fraud",OTHER
whitten93,Trump Derangement Syndrome in Democrats won't go away with Trump,
Pessimist2020,Fauci Renews Pandemic For Highly Anticipated Season 2,OTHER
Winterhold2000,"Merkel, Germany's 'eternal' chancellor, marks 15 years in power",OTHER
alc59,Remember when: Activists urge Clinton camp to challenge election results in three states,OTHER
InkyScrolls,Philly Bans All Indoor Gatherings Unless You're Still Counting Biden Votes,
guanaco55,"Trump campaign adviser Steve Cortes: Sudden Stop In Mail-In Vote Count 'Suspicious' -- Particularly since it was followed by a ""deluge"" of votes for Joe Biden in key battleground states.",
guanaco55,Trump Team Files for Fresh Recount in Georgia’s Presidential Race,
Foubar_ghost,CNN Condemns Trump Rallies As 'Physically Peaceful But Morally Violent',
optionhome,Florida Holocaust museum opens exhibition about George Floyd,OTHER
Winterhold2000,5 NBA Players Meet With Pope Francis To Talk Social Justice,OTHER
nobody65,Leftists Hate on Free Speech Platforms GAB and Parler: Where is this Going?,OTHER
DeanMalHanNJackIsms,Man spits on hikers for not wearing a mask,OTHER
westcoastwalruses,Inside the Fight to Abolish Police in Philadelphia,OTHER
newaccttrial,Dominion responds to Trump team claims,
guanaco55,"McEnany: We Have To Take Election To The Supreme Court To Expose ""Systemic Voter Fraud""",OTHER
guanaco55,HBO’s John Oliver Called It ‘Completely Insane’ to Use Electronic Voting Machines in Nov. 2019,OTHER
CornHuskManager,Sisolak limits gathering sizes for restaurants to 25% and require reservations to bars that serve food.,OTHER
guanaco55,Marsha Blackburn: Big Tech Censorship 'Choosing Winners And Losers',OTHER
subtle-distruption,President Trump Wanted a Supreme Court Election Battle. His Current Appeal Simply Cannot Get Him There.,
guanaco55,Polish Prime Minister: EU ‘Oligarchy’ Wielding ‘Propaganda Bludgeon’ Like Former Communist Regime,OTHER
Briguy28,"Nicolas Sarkozy, former President of France goes to trial on charges of corruption",OTHER
AEDELGOD,Here Is The Evidence,OTHER
Snipuh21,China Issues Instructions for ‘Incoming Biden Administration’,
PardonOurPolitics,Why Fewer People Should Go to College,OTHER
Farmwife64,Sacramento Sheriff on Not Enforcing COVID Curfew: Making Cops 'Instruments' of 'Oppression' Damages Community Relations,OTHER
ChunkyArsenio,Madeline Grant: UK hasn't had a pro-liberty PM since Thatcher,OTHER
Winterhold2000,GOP senator says Trump to Biden transition should begin 'tomorrow morning',
theradiostarz,Latest: Why a Federal Judge Tossed Out One of the Trump Campaign's PA Lawsuits,
Racheakt,Watergate reporter Carl Bernstein lists 21 GOP senators,OTHER
guanaco55,Ilhan Omar Urges Biden to ‘Reverse’ President Trump’s Middle East Agreements -- Thinks that peace between Israel and Arab nations is a bad thing.,
TheKinginMissouri,Christianity and the Future of American Conservatism | Mark Movsesian,OTHER
Foubar_ghost,Poll shows Republican favorability of Fox News has dropped after Election Day,OTHER
mrquestions666,An statement from Senator Toomey regarding the Pennyslvania Federal Court decision regarding the Trump campaign lawsuit.,
PurpleAngel23,U.S. retailer Guitar Center files for bankruptcy,OTHER
HighRoller390,"""Kracken"" is a ClA Hacking Program",OTHER
alc59,NY company makes window stickers of Cuomo watching over your Thanksgiving,OTHER
Throw1272,Judge Dismisses Trump Campaign Suit to Invalidate PA Election Certification With Prejudice,
guanaco55,Chris Christie Waddles to Lead the SurrenderCon Pack,OTHER
wra1th3_Ai,"NY Business Owners Kick Out Health Dept, Sheriffs: “Civil Disobedience Starts Now”",OTHER
ChunkyArsenio,"US Exits Open Skies Treaty, Moves to Discard Observation Planes",OTHER
radunas,"Chinese Warn Against Communism at Trump Rally, Tell Americans to Speak Out",
tenshon,Scranton dedicates 'Joe Biden Way' to honor president-elect,
Nuncle_Milty,"Waffle House’s Stand Against Lockdowns Is Exactly What America Needs—Almost | ""None of the people who make the decisions to shut down businesses and impact people's livelihoods ever have their own livelihood impacted,"" the Waffle House CEO recently told Business Insider.",OTHER
ChunkyArsenio,US seeks right to bomb Kenya as Islamic terrorists spread,OTHER
ChunkyArsenio,Dominic Lawson: The UK practices eugenics (on Down's Syndrome),OTHER
radunas,Ohio Shifts Red: Analysts Believe Buckeye State No Longer Swing State,OTHER
0ldManFrank,Hispanic Voters In Florida Who Fled Dictatorships Think The Election Was Stolen From Trump,
guanaco55,Michigan Canvass Board Member: 'Need Evidence' to Delay Certification,OTHER
Clackamas1,There’s a way to fix the $4.6 trillion U.S. public pensions mess — Canada shows us how,OTHER
samspenc,"Illinois Voter: ""You Don't 'Install' a President, You Elect a President""",OTHER
guitarzer0,Britons who test negative for Covid set to receive a 'freedom pass',OTHER
interestingfactoid,Pennsylvania election: Trump appeals dismissal of bid to block vote certification,
PettyWitch,The Death Star Strategy: Is Trump Contemplating The Ultimate Constitutional Trick Shot?,
GenZConservative1776,All Americans Should Celebrate Thanksgiving Despite Covid,OTHER
canfbar,Do Trump Supporters Live in an Alternate Universe?,
Foubar_ghost,Joseph Stalin To Receive International Emmy For His Outstanding Hunger Relief Efforts,OTHER
canfbar,REVEALED: Dominion/Smartmatic 'Noncompete' Agreement Emerges Despite Claims of Being 'Fierce Competitors',OTHER
AddictedReddit,"Obama won first election by invalidating signatures, filing complaints similar to Trump's",
Wing_attack_Plan_R,2008 FlashBack: CNN Says Obama Won His Senate Primary by Tossing Ballots Without Matching Signatures,OTHER
optimistic_marzipan,Huntington Beach protests California’s coronavirus curfew,OTHER
adp_17,DHS officials warn illegal border crossings are surging in anticipation of Biden presidency,
nobody65,"OUT: I Am Strong, I Am Invincible. IN: Boys Have Cooties! - Duke sorority council bans events with male groups.",OTHER
mikireal19,Texan Matthew McConaughey Considering Political Run – He’s Looking To Jump Straight To The Top As Governor,OTHER
ChunkyArsenio,Ross Clark: (UK) This is the next phase of a ruinous cycle of illogical restrictions,OTHER
nobody65,Making sense of the news about Sidney Powell,OTHER
ChunkyArsenio,Shelby Steele: The Inauthenticity Behind Black Lives Matter,OTHER
0ttervonBismarck,"Sidney Powell: 'Biblical' Lawsuit Coming, Accuses Ga. Gov. Kemp of Deal With Dominion",OTHER
tenshon,"Kelly Loeffler quarantining after positive, inconclusive coronavirus tests: campaign",OTHER
knownbuyer3,Actor Scott Baio threatens to move to Utah to unseat Sen. Mitt Romney after his anti-Trump tweet,
ThePoliticalHat,Why not ‘My Fuhrer’? Appeals court grills public college on forcing professor to call male student ‘miss’,OTHER
Jorgzs,Pennsylvania Judge Dismisses Trump Campaign's Challenge to Pennsylvania Election Law,
TheBaronOfTheNorth,Ben Carson: Trump Saved My Life After I Got COVID,
guanaco55,Republicans fuming after Dominion Voting Systems backs out night before scheduled PA oversight hearing,OTHER
optionhome,"Higher education cartoon of the week ""They pay You?""",OTHER
emaxwell13131313,"Gov. Andrew Cuomo to receive Emmy award for his 'leadership' during the pandemic, Twitter goes nuts",OTHER
ThePoliticalHat,"Eleventh Circuit Enjoins Local Ordinances Barring ""Conversion Therapy""",OTHER
guanaco55,Federal Election Commission Chair: Trump Campaign Has Legitimate Claims of Election Fraud,
nobody65,Texas Passes Law Banning Californians From Voting After They Move There,OTHER
nobody65,Democrats plan to bring back earmarks. Ready the pork barrel!,OTHER
radunas,"Chinese American Says the Left, Big Tech Reminds Him of Communist China",OTHER
nobody65,Don’t ‘Californicate’ The Rest Of America,OTHER
nobody65,Finally America is realizing that Andrew Cuomo is a putz,OTHER
nobody65,GOP Can't Let Trump-Hating Squishes Take Over the Party Now,
nobody65,Help! Pollsters Have Fallen and They Can't Get Up!,OTHER
Jezza_18,"Trump Orders Hasty Afghanistan, Iraq Drawdowns to Beat Biden Inauguration",
BaxterBlog,What the Media Is Hiding About the DHS’ Election Security Statement,OTHER
MuniPal,Trump campaign attorney responds to Pennsylvania ruling &amp; they’re grateful,
TheGloriousAmerican,"Op-Ed: 2020 Election Results Show No Irregularities, By Ruth Bader Ginsburg",OTHER
guanaco55,Trump Warns 'Massive Fraud' to Be Uncovered in Michigan Vote,
livinginbizzaroworld,"Report: Maryland Gov. Larry Hogan, Anti-Trump Hero, Paid for Flawed Coronavirus Tests from South Korea",
HighRoller390,"Georgia counties saw a mail-in ballot rejection rate as high as double digits, but magically all those problems disappeared in November? See the USA county map enclosed w/in the article for pre-November mail-in ballot rejection rates.",OTHER
invalid_data,"NY Business Owners Stand Up To Unconstitutional ""Lockdown"" Orders",OTHER
guanaco55,CA-25 Republican Rep. Mike Garcia Claims Victory; Democrat Christy Smith Cries Foul,OTHER
TheKinginMissouri,Who’s Afraid of the Common Good?,OTHER
outsidelight,"Just a reminder: Obama won his very first election by charging his opponents with election fraud. Oh, you didn't know?",OTHER
guanaco55,5 Reasons Making Taxpayers Pay Off Student Loans Is A Rotten Idea,OTHER
ChunkyArsenio,Ilana Mercer: Simplest Source of Voter Fraud Is Baked Into the System (Noncitizen voters),OTHER
adp_17,Donald Trump Improved Standing With Latinos In 78 Of America’s 100 Majority-Hispanic Counties,
alc59,G20 Leaders Move To Distribute Covid Vaccines Fairly,OTHER
Son_of_the_Roman,Dutch doctors allowed to sedate euthanasia patients before their death,OTHER
