author,title,topic
knownbuyer3,Philly Bans All Indoor Gatherings Unless You're Still Counting Biden Votes,
PressureMaxwell,What Makes Internet Trolls Tick?,OTHER
mikireal19,"After 2,600 Uncounted Votes Turn Up In Georgia – The Chief Elections Clerk Finds A Pink Slip Waiting For Him",OTHER
Shlomo_Maistre,Effort to recall Calif. Gov. Gavin Newsom granted 120 day extension to March 17 | One America News Network,OTHER
VernalPedestrian,Million MAGA March: Unravelling a Violent Viral Video,OTHER
Foubar_ghost,"If We Want People To Accept A COVID-19 Vaccine, We Should Stop Lying To Them About The Disease",OTHER
canfbar,U.K. to use AI tool to process 'high volume' of expected adverse reactions from COVID vaccine,OTHER
RedofPaw,Trump camp's lawsuit struck down in Pennsylvania,
ChunkyArsenio,Author Abigail Shrier faces threats after warning teen trans epidemic,OTHER
guanaco55,Sacramento Sheriff on Not Enforcing COVID Curfew: Making Cops 'Instruments' of 'Oppression' Damages Community Relations,OTHER
AtmanRising,Pa. Senator Pat Toomey Says President Trump Has 'Exhausted All Plausible Legal Options',
knownbuyer3,"Judge Dismisses Trump Campaign’s Pennsylvania Lawsuit, Slams ‘Strained’ Reasoning; This only helps these cases reach higher levels of court because signed affidavits are admissible in court",
whitten93,Biden's Surge In Polls Motivated By Fear,
Ravens1112003,Are Covid Patients Gasping ‘It Isn’t Real’ As They Die?,OTHER
Shlomo_Maistre,Recall California Governor Gavin Newsom (2020),OTHER
BaxterBlog,FLASHBACK: Experts Urge Clinton Campaign to Challenge Election Results in 3 Swing States (2016 claims of vote manipulation and hacking),OTHER
godsgonedogonnit,"Summary: The biggest threat to our democracy, freedom, and prosperity is a sycophant media that campaigns for one party and seeks to destroy the other. We are not a systemically racist country and it is absolutely not a threat to our democracy for anyone to challenge the results in an election.",OTHER
guanaco55,"Exiled Tibetan leader Lobsang Sangay visits White House, irking China",OTHER
tenshon,Trump campaign files for new recount in Georgia,
guanaco55,Hungarian Prime Minister: 'Soros One of the Most Corrupt People in World',OTHER
williesmom1,"China Hero Guangcheng Chen Decries Brutal Forced Abortions, Infanticide",OTHER
BranofRaisin,Top House conservative plots post-Trump GOP,
livinginbizzaroworld,Trump Announces Groundbreaking Rules to Lower Prescription Drug Prices,
guanaco55,Sidney Powell: Whistleblowers 'May Need Witness Protection' After Their Allegations Are Brought to Light,OTHER
Sartevscamus,"The Dems and Liberal Media Have Raised Issues with Dominion, Smartmatic, and ES&amp;S for 20 Years. The Left and media has Known About Chavez's Ties to Smartmatic since 2006. Here's the Stories That They Can't Unwrite",OTHER
XIIXOO,George Soros-Linked Election Software Company Lies About Ties With Dominion,OTHER
JonnyBlizzard,"Release: Toomey Statement on PA Federal Court Decision, Congratulates President-elect Biden | U.S. Senator Pat Toomey of Pennsylvania",
guanaco55,Biden to ‘Racist’ Trump Voters: ‘Let’s Heal.’ That’s Easy for Him to Say.,
guanaco55,"The Greatest Electoral Heist in American History -- The pieces are finally coming together, and they reveal a masterpiece of electoral larceny involving Big Tech oligarchs, activists, and government officials who prioritize partisanship over patriotism.",OTHER
whitten93,Study: Biden won thousands of illegal votes by noncitizens,
LawVol99,Feds seek death penalty against gang leader accused of 7 murders,OTHER
undue-influence,A Circuit Breaker on Election Night? (...nearly 30 percent of Democrat voters think the election was stolen from Trump),
radunas,Merkel's Germany Tells Trump Not to Bring Troops Home from Afghanistan,
LawVol99,Gov. Brown encourages Oregonians to call police on neighbors who violate COVID-19 freeze,OTHER
-mylankovic-,UN Hijacks #InternationalMensDay With Feminist “Wokeness”,OTHER
guanaco55,Regeneron Gets Emergency Clearance for COVID-19 Therapy,OTHER
MuniPal,Dr. Ben Carson: Trump Saved My Life After I Got COVID,
ChunkyArsenio,Nick Timonthy: UK will be living with the devastating costs of the Covid governance for decades,OTHER
canfbar,Unemployment benefits are the worst kind of pandemic relief,OTHER
guanaco55,CA-21 Republican David Valadao defeats Democrat Incumbent TJ Cox -- Reclaims another District stolen by ballot harvesting in 2018,OTHER
canfbar,"Here Comes the Biden Blame Game - If the double-dip recession hits next year, Biden will remind us over and over that it’s Donald Trump’s fault. He’ll be wrong.",
tomoon,Detroit voters sue President Trump over his attempt to block certification of election results,
The-Techie,AstraZeneca; Covid Vaccine 70% Effective,OTHER
guanaco55,"Why Gratitude Is Key To Worshiping Our Creator -- While praise, joy, contrition, and love are all important affections for worship, gratitude is the most important worship affection.",OTHER
bobbyw24,"If the double-dip recession hits next year, Biden will remind us over and over that it’s Donald Trump’s fault. He’ll be wrong.",
radunas,"New York City Cop Pummeled By Mob, Police Say",OTHER
Foubar_ghost,Michigan AG Suggests Criminally Charging Republican Legislators for Meeting With Trump,
whitten93,NY Mag Scientifically Proves Biden Supporters Are Racist,
guanaco55,"Pence Visits Georgia, Vows to ‘Keep Fighting Until Every Illegal Vote Is Thrown Out’",OTHER
HighRoller390,Wikileaks Dump - “KRAKEN” is a CIA Hacking Program,OTHER
guanaco55,"If You Liked the 'New World Order,' You’ll Love 'The Great Reset' -- Your betters think you need to be ""reset"" and Covid-19 has presented the ""opportunity.""",OTHER
TheBaronOfTheNorth,FDA Grants Emergency Use Authorization To Antibody Cocktail Used By Trump,
Juliemylove,"Drug overdose killed him, not my knee on his neck – Officer in George Floyd’s death",OTHER
tenshon,Tibetan political leader makes visit to White House for first time in six decades,OTHER
guanaco55,Xi Jinping’s Two Year Plan,OTHER
samspenc,"Green Card Holder in Nevada Received Mail-In Ballot: ""The Japanese man who is a green card holder said that although he is not a U.S. citizen, he received a mail-in ballot. He was puzzled as to why he was registered as a voter by local authorities.""",OTHER
romark1965,Berkeley professor sparks outrage by claiming Trump supporters who have an 'indifference' to COVID are like Germans who 'ignored and profited from the Holocaust',
Winterhold2000,Mark Levin: Letting Trump's legal efforts play out far better than 'what the Democrats are doing to our institutions',
undue-influence,"Howie Carr: Pam Kelley, another Kennedy casualty, passes away",OTHER
TheYoungLung,Trump campaign statement on Pennsylvania ruling,
JackLord50,"Dominion shuttering offices, shredding documents in dash to forestall post-election investigations",OTHER
therightnews,"Sens. Warren, Klobuchar Sent Letter Warning About Dominion, Other Election Tech in 2019",OTHER
geocentrist,Michigan Legislators Face Calls For Possible Criminal Charges After Meeting With President Trump On Certification,
guanaco55,"Jordan Sekulow: Pending Georgia Lawsuit 'Shocking' -- To those saying ""put up or shut up, it's coming this week.""",OTHER
IBiteYou,Gut check.,OTHER
guanaco55,Trump Lawyers: Pennsylvania Lawsuit Dismissal Moves Us Closer to Supreme Court,
cjdurrek,FDA Grants Emergency Use Authorization To Antibody Cocktail Used By Trump,
guanaco55,Federal Court Strikes Down Florida LGBTQ Counseling Ban -- Struck down laws that prohibit mental health professionals from counseling children and teens who are troubled by unwanted same-sex attractions or gender dysphoria.,OTHER
KillaB33z,"In new twist, Georgia governor urges audit of ballot envelop signatures to look for fraud",OTHER
blaspheminCapn,"Covid-19: Sweden's herd immunity strategy has failed, hospitals inundated",OTHER
tenshon,Ben Carson says he's 'out of the woods' after being 'extremely sick' with COVID-19,OTHER
ThaJerzeyDevil,It's getting bad out there better cancel 4th of July.,OTHER
optionhome,Gov. Cuomo wins Emmy for Best Portrayal of A Mass Murderer. “People around the world tuned in to find out what was going on and who Cuomo was going to kill next. It was really quite riveting”,OTHER
IJustWantToBePure,"Sheriffs not enforcing Newsom's coronavirus curfew, won't 'make criminals' of law-abiding citizens",OTHER
tenshon,"McEnany: Trump's path to victory is Supreme Court, exposing 'systemic' voter fraud",
ChunkyArsenio,"Lee Smith: Behind the Scenes, Obama Never Left",OTHER
adp_17,‘I Had To Protect Myself’: Rittenhouse Speaks Out Before Jail Release; New Details Emerge About Fatally Shot Rioter,OTHER
guanaco55,"Religion, Liberty, and Religious Liberty -- Emmanuel Macron Pushes France to Confront Islamism",OTHER
Shlomo_Maistre,"LIVE: March for Trump in Atlanta, Georgia",
ImbecileWillhelm,Ricky Schroder poses with accused Kenosha shooter after helping fund his $2 million bond,OTHER
XIIXOO,Twitter says it will hand control of US president's official account to Joe Biden on January 20 - regardless of whether Donald Trump has left the White House,
LawVol99,Trump’s gains in North Philly show Latino voters are not a ‘gimme’ for Democrats,
HighRoller390,"Once an election has been shown dirty, all voters have been disenfranchised- ""Joe Biden won illegal votes from thousands of noncitizens, study shows""",
Shlomo_Maistre,Giuliani Alleges Dominion Director's Ties to Antifa,OTHER
Clatsop,The “OFFICE”...,OTHER
Shlomo_Maistre,Green Card Holder in Nevada Received Mail-In Ballot,OTHER
HighRoller390,The ACLU and College Professors are Encouraging Book Burnings,OTHER
Doc_Liberty,Merkel's Germany Tells Trump Not to Bring Troops Home from Afghanistan,
jolielionne,Tucker Carlson And Media Elites Cozy Up To Private Equity Moguls,OTHER
jolielionne,"Democrats Do Drama – We Need to Stay Resolved, Disciplined, and Driven",OTHER
tenshon,Sen. Tom Cotton: It's the 400th anniversary of the Pilgrims' arrival. Why haven't we heard more about it?,OTHER
guanaco55,The Swing Senator -- How Susan Collins survived the resistance.,OTHER
guanaco55,Virginia Police Officers Deliver Thanksgiving Feasts Donated by Anonymous Family,OTHER
guanaco55,"Georgia Gov. Kemp Calls for Audit, Says Trump Can Demand New Recount",
Tvair450,Military flights up 500% last week,OTHER
geocentrist,Struggling Retailers Owe $52 Billion In Overdue Rents (Lockdown effect?),OTHER
Shlomo_Maistre,Jordan Sekulow to Newsmax TV: Pending Georgia Lawsuit 'Shocking',OTHER
invalid_data,Watch: Hundreds of Activists Gather for 'Stop the Steal' Rally in Georgia,OTHER
